{
  "host": "codex",
  "verified_on": "2026-09-08",
  "source": "OpenAI Codex subagents and hooks documentation: https://developers.openai.com/codex/subagents and https://developers.openai.com/codex/hooks; validated against codex-cli 0.147.0.",
  "agent_dir": ".codex/agents",
  "bundled_dir": "adapters/codex/agents",
  "format": "toml",
  "required_fields": [
    "name",
    "description",
    "developer_instructions"
  ],
  "tool_map": {
    "edit-files": [
      "apply_patch"
    ],
    "create-files": [
      "apply_patch"
    ],
    "run-commands": [
      "Bash"
    ]
  },
  "model_map": {
    "cheap": "gpt-5.6-luna",
    "mid": "gpt-5.6-terra",
    "strong": "gpt-5.6-sol"
  },
  "effort_map": {
    "low": "low",
    "medium": "medium",
    "high": "high",
    "xhigh": "xhigh",
    "max": "max"
  },
  "capabilities": {
    "explicit_model": {
      "supported": true,
      "field": "model",
      "verified": "Any model named in config.toml. Unset inherits from the parent, so it is always written."
    },
    "reasoning_effort": {
      "supported": true,
      "field": "model_reasoning_effort",
      "verified": "Documented per-agent key. Supported GPT models expose low, medium, high, xhigh, and max; the selected model determines which levels are accepted."
    },
    "tool_allowlist": {
      "supported": false,
      "field": null,
      "verified": "No per-agent tool allowlist is documented; only mcp_servers scopes what an agent reaches. A tool grant therefore renders as an instruction plus an unenforced disclosure, never as a claim of isolation."
    },
    "tool_denylist": {
      "supported": false,
      "field": null,
      "verified": "No documented denylist key."
    },
    "read_only_enforced": {
      "supported": true,
      "field": "sandbox_mode",
      "verified": "sandbox_mode = \"read-only\" is enforced by the host sandbox. A parent session's live sandbox or approval policy can still override a custom agent default, so this is not an absolute project policy boundary."
    },
    "scoped_hooks": {
      "supported": false,
      "field": null,
      "verified": "No per-agent hook mechanism is documented. Codex PreToolUse payloads do not document worker identity, so root-versus-worker write separation is instructional and review-based, not hook-enforced."
    }
  }
}
